{
 "$schema": "./notice-reasons.schema.json",
 "$comment": [
  "SINGLE SOURCE OF TRUTH -- EDIT THIS FILE.",
  "The notice roster (CR-712, JDG-1751): every reason a telling can carry (table T-233) and every question a confirmation can show (table T-234) -- row id, scene, manner, source and how it is displayed. It holds NO WORDS: the words stay in _source/display-words.json, keyed by the same row id.",
  "Generated FROM this file: _assets/tbl-notice-reasons.md (notice_reasons_json_to_md.py), the generated region of src/use-case/advance-screen-session/notice-values.ts (tools/generate_notice_reasons.py), and the reason and question rosters tools/generate_display_words.py holds the dictionary against.",
  "Rebuild: npm run gen   |   npm run gen:check fails if anything has drifted.",
  "Validated by _source/notice-reasons.schema.json. notice_reasons_json_to_md.py also refuses a row id written twice, a row id of the wrong prefix, a `wordsOf` that names no row of this file, names a row that itself shares words, or names a row of another manner or display, and an `invariantRefusals.wordsOf` key that is no row of table T-220.",
  "Cells are the Markdown the tables print, byte for byte: `scene`, `source` and `names` are language dictionaries (Chapter 6.2) and the generator puts nothing into them. `manner` is a row id of table T-037 and is printed in a code span.",
  "`display` says how a reason reaches the screen: show (a notice that stands until NT-8 dismisses it), autoDismiss (a notice that leaves by itself after a time, NT-2), hide (raised and carried, never put on the screen), report (inside one reading, a line of the Import Report U-62 instead of a notice). A question is ask, or askOnlyWithUnsavedEdits. The printed tables carry it as the column the table's `displayLabels` name.",
  "`wordsOf` names the row whose words the screen prints for this one (CR-712 X-2); the row stays a row, and the Agent API refusal still carries it. `invariantRefusals.wordsOf` does the same for a row of table T-220.",
  "Rows are in the order the tables print them, which is not the numeric order."
 ],
 "reasonTable": {
  "id": "T-233",
  "caption": {
   "ja": "通知が運ぶ理由"
  },
  "columns": {
   "ja": [
    "行 ID",
    "場面",
    "作法",
    "表示の仕方",
    "まとめ方",
    "正"
   ]
  },
  "displayLabels": {
   "show": {
    "ja": "出す"
   },
   "autoDismiss": {
    "ja": "時間で消す"
   },
   "hide": {
    "ja": "出さない"
   },
   "report": {
    "ja": "`U-62` に並べる"
   }
  },
  "wordsOfLabel": {
   "ja": "語は `{row}`"
  },
  "ownWordsLabel": {
   "ja": "—"
  }
 },
 "questionTable": {
  "id": "T-234",
  "caption": {
   "ja": "問いが示す文"
  },
  "columns": {
   "ja": [
    "行 ID",
    "場面",
    "名前を挙げるか",
    "問うか",
    "正"
   ]
  },
  "displayLabels": {
   "ask": {
    "ja": "問う"
   },
   "askOnlyWithUnsavedEdits": {
    "ja": "保存していない編集があるときだけ問う"
   }
  }
 },
 "reasons": [
  {
   "id": "RS-1",
   "scene": {
    "ja": "覚えているファイルへ、いま書き込む権限が無い"
   },
   "manner": "NT-3a",
   "source": {
    "ja": "`FR-060`"
   },
   "display": "show"
  },
  {
   "id": "RS-2",
   "scene": {
    "ja": "開いているファイルが無いので、上書きする先が無い"
   },
   "manner": "NT-3a",
   "source": {
    "ja": "`FR-060`"
   },
   "display": "show"
  },
  {
   "id": "RS-3",
   "scene": {
    "ja": "書き込みを試みたが、この環境では行えなかった"
   },
   "manner": "NT-3a",
   "source": {
    "ja": "表 T-004 の `LM-14`"
   },
   "display": "show"
  },
  {
   "id": "RS-4",
   "scene": {
    "ja": "バイト列が UTF-8 でないので、文字として読めない"
   },
   "manner": "NT-1",
   "source": {
    "ja": "表 T-003 の `CN-5`"
   },
   "display": "show"
  },
  {
   "id": "RS-5",
   "scene": {
    "ja": "書出だけの形式で、開いたファイルへ上書きしようとした"
   },
   "manner": "NT-1",
   "source": {
    "ja": "`FR-096`"
   },
   "display": "show"
  },
  {
   "id": "RS-6",
   "scene": {
    "ja": "読んだ刻印が現在のものでない"
   },
   "manner": "NT-1",
   "source": {
    "ja": "表 T-067 の `WS-1`"
   },
   "display": "show"
  },
  {
   "id": "RS-7",
   "scene": {
    "ja": "文書を変える身振りの最中である"
   },
   "manner": "NT-1",
   "source": {
    "ja": "表 T-067 の `WS-2`"
   },
   "display": "show",
   "wordsOf": "RS-6"
  },
  {
   "id": "RS-8",
   "scene": {
    "ja": "その場の編集がまだ確定していない"
   },
   "manner": "NT-1",
   "source": {
    "ja": "表 T-067 の `WS-2`"
   },
   "display": "show"
  },
  {
   "id": "RS-9",
   "scene": {
    "ja": "通知を配っている最中である"
   },
   "manner": "NT-1",
   "source": {
    "ja": "表 T-067 の `WS-2`"
   },
   "display": "show",
   "wordsOf": "RS-6"
  },
  {
   "id": "RS-10",
   "scene": {
    "ja": "命令が拒否されたので、束ごと落とした"
   },
   "manner": "NT-1",
   "source": {
    "ja": "表 T-067 の `WS-3`"
   },
   "display": "show"
  },
  {
   "id": "RS-11",
   "scene": {
    "ja": "拡張子が 表 T-024 のどの行にも当たらない"
   },
   "manner": "NT-1",
   "source": {
    "ja": "表 T-024a の `OP-12`"
   },
   "display": "show"
  },
  {
   "id": "RS-12",
   "scene": {
    "ja": "先頭の非空白の文字が 表 T-024 のどの行にも当たらない"
   },
   "manner": "NT-1",
   "source": {
    "ja": "表 T-024a の `OP-12`"
   },
   "display": "show",
   "wordsOf": "RS-11"
  },
  {
   "id": "RS-13",
   "scene": {
    "ja": "拡張子と先頭の文字が、同じ 1 行を指さない"
   },
   "manner": "NT-1",
   "source": {
    "ja": "表 T-024a の `OP-12`"
   },
   "display": "show",
   "wordsOf": "RS-11"
  },
  {
   "id": "RS-14",
   "scene": {
    "ja": "一度に複数のファイルが渡され、先頭だけを受け付けた"
   },
   "manner": "NT-5",
   "source": {
    "ja": "表 T-024a の `OP-11`"
   },
   "display": "report"
  },
  {
   "id": "RS-78",
   "scene": {
    "ja": "取り込むファイルの大きさが `S-113` を超える"
   },
   "manner": "NT-6",
   "source": {
    "ja": "`FR-023` ／ 表 T-211 の `S-113`"
   },
   "display": "show"
  },
  {
   "id": "RS-79",
   "scene": {
    "ja": "取り込む `Task` の件数が `S-114` を超える"
   },
   "manner": "NT-6",
   "source": {
    "ja": "`FR-023` ／ 表 T-211 の `S-114`"
   },
   "display": "show"
  },
  {
   "id": "RS-80",
   "scene": {
    "ja": "取り込む `Task` の入れ子（WBS）の深さが `S-115` を超える"
   },
   "manner": "NT-6",
   "source": {
    "ja": "`FR-023` ／ 表 T-211 の `S-115`"
   },
   "display": "show"
  },
  {
   "id": "RS-81",
   "scene": {
    "ja": "取り込む `Task` に `start` か `finish` が無い（表 T-033 の `EX-5` の中身の無い行を除く）"
   },
   "manner": "NT-1",
   "source": {
    "ja": "`FR-012`"
   },
   "display": "show"
  },
  {
   "id": "RS-16",
   "scene": {
    "ja": "重ねる側のタスクに、`UID` の一致する現在のタスクが無い"
   },
   "manner": "NT-5",
   "source": {
    "ja": "`FR-015`"
   },
   "display": "report"
  },
  {
   "id": "RS-19",
   "scene": {
    "ja": "透かしに出す名前が、まだ設定されていない⚠️ **表示の仕方は「出さない」である** —— 設定する道が作られていないので、「設定されていません」と告げても読む人には何もできることが無い。<br>黙っているより悪い。<br>⭐ **語は残す** —— `FR-086` の入口をあとで作るときに、そのまま使う。<br>消すと書き直すことになる。<br>"
   },
   "manner": "NT-4",
   "source": {
    "ja": "`FR-086`"
   },
   "display": "hide"
  },
  {
   "id": "RS-20",
   "scene": {
    "ja": "`Agent API` を無効にしても、既に渡した参照は取り消せない"
   },
   "manner": "NT-5",
   "source": {
    "ja": "`FR-065`"
   },
   "display": "show"
  },
  {
   "id": "RS-21",
   "scene": {
    "ja": "稼働する曜日を 1 つも持たない暦なので、文書の暦にできない"
   },
   "manner": "NT-1",
   "source": {
    "ja": "`FR-088`"
   },
   "display": "show"
  },
  {
   "id": "RS-22",
   "scene": {
    "ja": "収まらないので描かなかった `TaskGroup` と `Task` がある。<br>⛔ **この理由を上げる者はいない** —— `FR-025` が「収まらないときは書き出さない」と定め、一部だけ描く場面が無い。<br>⚠️ **行は消さずに残す** —— 席番号を別の場面に再び使わせないためである。<br>⛔ **新しい場面に流用してはならない（MUST NOT）**"
   },
   "manner": "NT-5",
   "source": {
    "ja": "`FR-025`"
   },
   "display": "hide"
  },
  {
   "id": "RS-23",
   "scene": {
    "ja": "監視の配り先が答えを返さなかった"
   },
   "manner": "NT-3a",
   "source": {
    "ja": "表 T-035 の `AG-6`"
   },
   "display": "autoDismiss"
  },
  {
   "id": "RS-24",
   "scene": {
    "ja": "1 つの `TaskGroup` の段数が安全弁に達したので、これ以上積めない"
   },
   "manner": "NT-3a",
   "source": {
    "ja": "表 T-014 の `ST-7`"
   },
   "display": "show"
  },
  {
   "id": "RS-25",
   "scene": {
    "ja": "読んだ `GRS JSON` の列が、決められた形に合わない"
   },
   "manner": "NT-1",
   "source": {
    "ja": "Chapter 6.1 の 表 T-220 の前文"
   },
   "display": "show"
  },
  {
   "id": "RS-26",
   "scene": {
    "ja": "起動時に渡された文書が読めなかった"
   },
   "manner": "NT-1",
   "source": {
    "ja": "表 T-024a の `OP-14`"
   },
   "display": "show"
  },
  {
   "id": "RS-27",
   "scene": {
    "ja": "押した入口が、いま行えることを持たない"
   },
   "manner": "NT-1",
   "source": {
    "ja": "`FR-029`"
   },
   "display": "hide"
  },
  {
   "id": "RS-28",
   "scene": {
    "ja": "配下に、展開できるタスクグループが 1 つも無い"
   },
   "manner": "NT-1",
   "source": {
    "ja": "表 T-051 の `HF-2`"
   },
   "display": "hide"
  },
  {
   "id": "RS-29",
   "scene": {
    "ja": "そのタスクグループは、描かれている子を 1 つも持たない"
   },
   "manner": "NT-1",
   "source": {
    "ja": "表 T-051 の `HF-11`"
   },
   "display": "hide"
  },
  {
   "id": "RS-30",
   "scene": {
    "ja": "直下に、画面へ戻せる子が 1 つも無い"
   },
   "manner": "NT-1",
   "source": {
    "ja": "表 T-051 の `HF-13`"
   },
   "display": "hide"
  },
  {
   "id": "RS-31",
   "scene": {
    "ja": "描かれていないタスクグループが 1 つも無い"
   },
   "manner": "NT-1",
   "source": {
    "ja": "表 T-051 の `HF-10`"
   },
   "display": "hide"
  },
  {
   "id": "RS-32",
   "scene": {
    "ja": "展開しているタスクグループが 1 つも無い"
   },
   "manner": "NT-1",
   "source": {
    "ja": "表 T-051 の `HF-12`"
   },
   "display": "hide"
  },
  {
   "id": "RS-33",
   "scene": {
    "ja": "予定と実績のうち、いま出ているのが一方だけである"
   },
   "manner": "NT-1",
   "source": {
    "ja": "`FR-049`"
   },
   "display": "autoDismiss"
  },
  {
   "id": "RS-34",
   "scene": {
    "ja": "揃える相手の `Task` が選ばれていない"
   },
   "manner": "NT-1",
   "source": {
    "ja": "`FR-034`"
   },
   "display": "hide"
  },
  {
   "id": "RS-40",
   "scene": {
    "ja": "**この形式は、このビルドではまだ書けない**"
   },
   "manner": "NT-3a",
   "source": {
    "ja": "表 T-024"
   },
   "display": "hide"
  },
  {
   "id": "RS-41",
   "scene": {
    "ja": "**透かし解除パスワードが合わない**"
   },
   "manner": "NT-3a",
   "source": {
    "ja": "`FR-020`"
   },
   "display": "show"
  },
  {
   "id": "RS-42",
   "scene": {
    "ja": "**原因の分からない失敗**"
   },
   "manner": "NT-3a",
   "source": {
    "ja": "`FR-102`"
   },
   "display": "show",
   "wordsOf": "RS-15"
  },
  {
   "id": "RS-43",
   "scene": {